{
  "ko_number": "KO20007",
  "subject": "Excel freezes when filtering large worksheet",
  "configuration_item": "Microsoft 365 (Excel)",
  "state": "Published",
  "description": "Workbook ~50k rows; applying filter hangs Excel for minutes; user fears data loss.",
  "ts_steps": [
    {
      "step": 1,
      "title": "Calculation mode",
      "action": "Formulas → Calculation Options — Manual temporarily; apply filter; recalculate once."
    },
    {
      "step": 2,
      "title": "Table and formats",
      "action": "Convert range to Excel Table; remove excessive conditional formatting on entire columns."
    },
    {
      "step": 3,
      "title": "64-bit and repair",
      "action": "Confirm 64-bit Office; Online Repair from Apps & Features if corruption suspected."
    }
  ],
  "internal_information": "Volatile functions over big ranges, whole-column references, or graphics driver interaction. Power Query alternative for huge data."
}
