{
  "ko_number": "KO10002",
  "subject": "Bluetooth mouse keeps disconnecting",
  "configuration_item": "macOS (Apple Silicon)",
  "state": "Published",
  "description": "Wireless mouse drops connection several times per day; works again after toggle or reboot.",
  "ts_steps": [
    { "step": 1, "title": "Battery and physical range", "action": "Replace or recharge batteries; keep mouse within 1–2 m of Mac with clear line of sight." },
    { "step": 2, "title": "Reduce RF interference", "action": "Move bus-powered Thunderbolt/USB4 hubs and fast USB-C accessories away from the Mac and mouse; metal desk clutter can attenuate 2.4 GHz." },
    { "step": 3, "title": "Forget device", "action": "System Settings → Bluetooth → (i) on mouse → Forget This Device → confirm." },
    { "step": 4, "title": "Pair again", "action": "Put mouse in pairing mode per vendor. Pair from Bluetooth list. Confirm Connected and battery % if shown." },
    { "step": 5, "title": "Bluetooth toggle", "action": "System Settings → Bluetooth → Off, wait 15 s, On. Disconnect other Bluetooth audio devices that might contend for the radio." },
    { "step": 6, "title": "Quit conflicting apps", "action": "Quit remote desktop or input-capture apps that may reset HID focus. Cmd+Q Safari tabs with heavy WebRTC rarely matter but close meeting apps using the mouse exclusively." },
    { "step": 7, "title": "Restart macOS", "action": "Apple menu → Restart — clears stuck Bluetooth daemon state." },
    { "step": 8, "title": "Safe Mode test", "action": "Shut down, power on holding power until startup options → volume → hold Shift → Continue in Safe Mode. Test mouse stability briefly." },
    { "step": 9, "title": "Login items", "action": "If stable only in Safe Mode: System Settings → General → Login Items — disable third-party agents in batches and reboot between tests." },
    { "step": 10, "title": "Hardware swap", "action": "Test same mouse on another Apple Silicon Mac or swap mouse — isolates device vs environment." }
  ],
  "internal_information": "Apple Silicon integrated Bluetooth; RF and USB4 noise dominate. No Intel/SMC narrative."
}
