{
  "ko_number": "KO40009",
  "subject": "Excel opens downloaded file in Protected View — cannot edit",
  "configuration_item": "Microsoft 365 (Excel)",
  "state": "Published",
  "description": "File from email opens read-only yellow bar; Enable Editing grayed for user.",
  "ts_steps": [
    {
      "step": 1,
      "title": "Unblock file",
      "action": "File Properties on saved copy — check Unblock at bottom; reopen."
    },
    {
      "step": 2,
      "title": "Trust location",
      "action": "Add trusted folder for known internal download path if policy allows."
    },
    {
      "step": 3,
      "title": "DLP prompt",
      "action": "If corporate banner blocks edit, complete justification workflow or save to approved library."
    }
  ],
  "internal_information": "Mark of the Web zone identifier. DLP may overlay Excel. Different from macro blocking — check both."
}
