{
  "ko_number": "KO40003",
  "subject": "iPhone storage full — cannot update apps",
  "configuration_item": "iPhone (iOS)",
  "state": "Published",
  "description": "User sees 'Not Enough Storage' when trying to update apps or take photos; phone feels slow.",
  "ts_steps": [
    {
      "step": 1,
      "title": "Review storage breakdown",
      "action": "Settings → General → iPhone Storage — wait for bar to load; review list sorted by size and note largest apps or 'Other/System Data'."
    },
    {
      "step": 2,
      "title": "Offload unused apps",
      "action": "Tap an unused large app → Offload App (keeps data, frees binary). For media-heavy apps like Photos, enable iCloud Photos or transfer to PC."
    },
    {
      "step": 3,
      "title": "Clear Safari and Messages data",
      "action": "Settings → Safari → Clear History and Website Data; Settings → Messages → Keep Messages → 1 Year or 30 Days to auto-delete old threads."
    }
  ],
  "internal_information": "System Data bloat is common after multiple OTA updates; a backup-and-restore can reclaim space. Large 'Other' category may also be streaming caches from Music or Podcasts."
}
