{
  "ko_number": "KO40004",
  "subject": "Outlook search returns no results for known mail",
  "configuration_item": "Microsoft 365 (Outlook)",
  "state": "Published",
  "description": "Search box finds nothing; user can browse folder and see the message manually.",
  "ts_steps": [
    {
      "step": 1,
      "title": "Index status",
      "action": "File → Options → Search — Indexing Status; confirm mailbox indexed; rebuild if stuck."
    },
    {
      "step": 2,
      "title": "Scope",
      "action": "Use Current Mailbox scope; try web Outlook search to compare server-side index."
    },
    {
      "step": 3,
      "title": "OST size",
      "action": "If OST huge, consider new profile or online mode test; compact ost if supported."
    }
  ],
  "internal_information": "Broken Windows Search index for desktop Outlook. Exchange Online vs on-prem differs. New Outlook vs classic."
}
